{
  "artifact_type": "run",
  "backend_commit": "73784b96a1afdb34dc1a79577f947b670a138d07",
  "build_provenance_sha256": "d47660fe9807f6ab79a072423cbd147cacd5e0bc8bfaaa17ae552b04a4af37bb",
  "candidate_id": "P0-A2",
  "corrected_emulated_cycles_per_wall_second": 4316064.642445762,
  "cycles": 827799818,
  "elapsed_us": 3320000,
  "emulated_cycles_per_wall_second": 5144712.785438511,
  "guest_observation_sha256": "9bbbb92bd48a854b3b5824de0f2bf1dc0c760c8a74d1dee7533b409bea12debc",
  "host_speed_correction": 0.8389320886215189,
  "host_usage_delta": {
    "max_rss_platform_units": 30748,
    "max_rss_scope": "children_cumulative",
    "system_seconds": 0.004226000000000063,
    "user_seconds": 170.004108000001
  },
  "order": "AB",
  "pair": 9,
  "predicted_anchor_throughput": 5232916.492848924,
  "protocol_elapsed_seconds": 15213.754803822,
  "record_id": "rp2040-cpu-p0-null-v3-20260901-02",
  "report_sha256": "0f96b79c20c50f8563ffb6aed639c85187593a89eec6c36e8c79b52fe6fc931b",
  "role": "baseline",
  "run_id": "run-035",
  "runner_sha256": "921c923df12d88e0fa8edda470ffff252f62d3047f1836c3080ada824fae25c7",
  "schema_id": "picocalc.rp2040-cpu-ab",
  "schema_version": 1,
  "snapshot_sha256": {
    "picoedit-final.png": "df614d4a7453fc408197afcce6a5b5f2f1292c1ea32a152d662528db3da52e69"
  },
  "stop_reason": "scenario_done",
  "uart_sha256": "2a37433c341bacf59ec0cbcafae6d4f29eb83cc7da17bb2237f0addc0009de33",
  "wall_ns": 160903018793,
  "wall_seconds": 160.903018793,
  "workload": "picoedit-r1-vrp2f"
}
