{
  "artifact_type": "correctness",
  "baseline": {
    "backend_commit": "73784b96a1afdb34dc1a79577f947b670a138d07",
    "build_provenance_sha256": "d47660fe9807f6ab79a072423cbd147cacd5e0bc8bfaaa17ae552b04a4af37bb",
    "cycles": 927528659,
    "elapsed_us": 3715000,
    "emulated_cycles_per_wall_second": 5006309.838105988,
    "guest_observation_sha256": "4f5709fbec051cdd1dd181679c71154e04c84e5734327671399057f4035dd616",
    "host_usage_delta": {
      "max_rss_platform_units": 29772,
      "max_rss_scope": "children_cumulative",
      "system_seconds": 0.012634,
      "user_seconds": 195.032996
    },
    "report_sha256": "52731c8cc7cf98eca6146e2613dc26c044f22f5eadd34b46343571ffbe89a47b",
    "runner_sha256": "921c923df12d88e0fa8edda470ffff252f62d3047f1836c3080ada824fae25c7",
    "snapshot_sha256": {
      "tetris-line-clear.png": "e3a90df645eba0bb11eb642190dea5dda9928394cf4aa7880c7a552d815d4958"
    },
    "stop_reason": "scenario_done",
    "uart_sha256": "bff1f2452ee65a2279a805c828a6c3afc75bb238fd1859f43962f8e1f6e9266c",
    "wall_ns": 185271924630,
    "wall_seconds": 185.27192463
  },
  "baseline_guest_observation_sha256": "4f5709fbec051cdd1dd181679c71154e04c84e5734327671399057f4035dd616",
  "behavior_equal": true,
  "candidate": {
    "backend_commit": "73784b96a1afdb34dc1a79577f947b670a138d07",
    "build_provenance_sha256": "d47660fe9807f6ab79a072423cbd147cacd5e0bc8bfaaa17ae552b04a4af37bb",
    "cycles": 927528659,
    "elapsed_us": 3715000,
    "emulated_cycles_per_wall_second": 5031065.458142329,
    "guest_observation_sha256": "4f5709fbec051cdd1dd181679c71154e04c84e5734327671399057f4035dd616",
    "host_usage_delta": {
      "max_rss_platform_units": 29772,
      "max_rss_scope": "children_cumulative",
      "system_seconds": 0.03369900000000001,
      "user_seconds": 194.09754200000003
    },
    "report_sha256": "52731c8cc7cf98eca6146e2613dc26c044f22f5eadd34b46343571ffbe89a47b",
    "runner_sha256": "921c923df12d88e0fa8edda470ffff252f62d3047f1836c3080ada824fae25c7",
    "snapshot_sha256": {
      "tetris-line-clear.png": "e3a90df645eba0bb11eb642190dea5dda9928394cf4aa7880c7a552d815d4958"
    },
    "stop_reason": "scenario_done",
    "uart_sha256": "bff1f2452ee65a2279a805c828a6c3afc75bb238fd1859f43962f8e1f6e9266c",
    "wall_ns": 184360284460,
    "wall_seconds": 184.36028446
  },
  "candidate_guest_observation_sha256": "4f5709fbec051cdd1dd181679c71154e04c84e5734327671399057f4035dd616",
  "candidate_id": "P0-A2",
  "guest_observation_equal": true,
  "guest_observation_sha256": "4f5709fbec051cdd1dd181679c71154e04c84e5734327671399057f4035dd616",
  "record_id": "rp2040-cpu-p0-null-20260831-04",
  "schema_id": "picocalc.rp2040-cpu-ab",
  "schema_version": 1,
  "status": "pass",
  "trace_required": false,
  "workload": "picotetris-opt1b-vrp5"
}
