{
  "artifact_type": "correctness",
  "baseline": {
    "backend_commit": "73784b96a1afdb34dc1a79577f947b670a138d07",
    "build_provenance_sha256": "d47660fe9807f6ab79a072423cbd147cacd5e0bc8bfaaa17ae552b04a4af37bb",
    "cycles": 827799818,
    "elapsed_us": 3320000,
    "emulated_cycles_per_wall_second": 4797809.225756803,
    "guest_observation_sha256": "9bbbb92bd48a854b3b5824de0f2bf1dc0c760c8a74d1dee7533b409bea12debc",
    "host_usage_delta": {
      "max_rss_platform_units": 36396,
      "max_rss_scope": "children_cumulative",
      "system_seconds": 0.019997999999999995,
      "user_seconds": 172.483718
    },
    "report_sha256": "0f96b79c20c50f8563ffb6aed639c85187593a89eec6c36e8c79b52fe6fc931b",
    "runner_sha256": "921c923df12d88e0fa8edda470ffff252f62d3047f1836c3080ada824fae25c7",
    "snapshot_sha256": {
      "picoedit-final.png": "df614d4a7453fc408197afcce6a5b5f2f1292c1ea32a152d662528db3da52e69"
    },
    "stop_reason": "scenario_done",
    "uart_sha256": "2a37433c341bacf59ec0cbcafae6d4f29eb83cc7da17bb2237f0addc0009de33",
    "wall_ns": 172537043273,
    "wall_seconds": 172.537043273
  },
  "baseline_guest_observation_sha256": "9bbbb92bd48a854b3b5824de0f2bf1dc0c760c8a74d1dee7533b409bea12debc",
  "behavior_equal": true,
  "candidate": {
    "backend_commit": "73784b96a1afdb34dc1a79577f947b670a138d07",
    "build_provenance_sha256": "d47660fe9807f6ab79a072423cbd147cacd5e0bc8bfaaa17ae552b04a4af37bb",
    "cycles": 827799818,
    "elapsed_us": 3320000,
    "emulated_cycles_per_wall_second": 4938393.179093335,
    "guest_observation_sha256": "9bbbb92bd48a854b3b5824de0f2bf1dc0c760c8a74d1dee7533b409bea12debc",
    "host_usage_delta": {
      "max_rss_platform_units": 36396,
      "max_rss_scope": "children_cumulative",
      "system_seconds": 0.0040000000000000036,
      "user_seconds": 167.5957689999999
    },
    "report_sha256": "0f96b79c20c50f8563ffb6aed639c85187593a89eec6c36e8c79b52fe6fc931b",
    "runner_sha256": "921c923df12d88e0fa8edda470ffff252f62d3047f1836c3080ada824fae25c7",
    "snapshot_sha256": {
      "picoedit-final.png": "df614d4a7453fc408197afcce6a5b5f2f1292c1ea32a152d662528db3da52e69"
    },
    "stop_reason": "scenario_done",
    "uart_sha256": "2a37433c341bacf59ec0cbcafae6d4f29eb83cc7da17bb2237f0addc0009de33",
    "wall_ns": 167625336416,
    "wall_seconds": 167.625336416
  },
  "candidate_guest_observation_sha256": "9bbbb92bd48a854b3b5824de0f2bf1dc0c760c8a74d1dee7533b409bea12debc",
  "candidate_id": "P0-A2",
  "guest_observation_equal": true,
  "guest_observation_sha256": "9bbbb92bd48a854b3b5824de0f2bf1dc0c760c8a74d1dee7533b409bea12debc",
  "record_id": "rp2040-cpu-p0-null-20260831-01",
  "schema_id": "picocalc.rp2040-cpu-ab",
  "schema_version": 1,
  "status": "pass",
  "trace_required": false,
  "workload": "picoedit-r1-vrp2f"
}
